<?xml version="1.0" encoding="UTF-8"?>
<ns0:system 
  xmlns:xsi="http://www.w3.org/2001/XMLSchema-instance" 
  xmlns:ns0="http://www.invenireaude.org/qsystem"
  xsi:type="ns0:System" 
  xsi:schemaLocation="http://www.invenireaude.org/qsystem ../../../IAS-QSystemLib/xsd/qsystem.xsd"
  name="sample">

  <memory>
	<heap  value= "50000000"/>      
	<queue value= "50000000"/>
	<data  value="500000000"/>
  </memory>     
  
  <sessions>
    <maxSessions>500</maxSessions>    
  </sessions>
  
  <queues>      
     <maxQueues>100</maxQueues>
     <dftSize>100</dftSize>
  </queues>
 
  <content>
    <maxEntries>150000</maxEntries>
  </content>
 
  <actions xsi:type="ns0:ActionCreateQueue">
    <queueDefinition name="Q.SAMPLE">
       	<overwriteWhenFull>true</overwriteWhenFull>
    </queueDefinition>
  </actions>
 
  <actions xsi:type="ns0:ActionCreateQueue">
    <queueDefinition name="Q.TEST">
       	<overwriteWhenFull>true</overwriteWhenFull>
    </queueDefinition>
  </actions>
  
  <actions xsi:type="ns0:ActionCreateQueue">
    <queueDefinition name="Q.STATS">
        <size>1</size>
       	<overwriteWhenFull>true</overwriteWhenFull>
    </queueDefinition>
  </actions>
  
</ns0:system>
